{
  "project_id": "MASK-000305",
  "revision": 1,
  "target": {
    "object": "Test panel",
    "part": "Flat practice panel",
    "part_code": "PANEL",
    "dimensions_mm": [
      260.0,
      180.0
    ]
  },
  "_comment": "TEST 5. Six layers on one panel in the intended application order. Expected: PASS. This is the target complexity for the MVP. The open question is not whether it validates but whether registration error accumulated across six weed-position-peel cycles still lands on a recognisable design. With a 0.35 mm registration tolerance and six cycles, that is the number to watch and the reason this test exists.",
  "_expect": {
    "outcome": "verdict",
    "verdict": "PASS_WITH_WARNINGS",
    "warnings": [
      "min_feature_length"
    ]
  },
  "layers": [
    {
      "index": 1,
      "name": "01 Black Base",
      "width_mm": 2.2,
      "centrelines": [
        [
          [
            15,
            15
          ],
          [
            235,
            15
          ],
          [
            235,
            165
          ],
          [
            15,
            165
          ],
          [
            15,
            15
          ]
        ],
        [
          [
            15,
            90
          ],
          [
            235,
            90
          ]
        ]
      ]
    },
    {
      "index": 2,
      "name": "02 Black Shadow",
      "width_mm": 1.4,
      "centrelines": [
        [
          [
            40,
            40
          ],
          [
            140,
            40
          ],
          [
            180,
            80
          ],
          [
            220,
            80
          ]
        ]
      ]
    },
    {
      "index": 3,
      "name": "03 Red Base",
      "width_mm": 1.6,
      "centrelines": [
        [
          [
            60,
            60
          ],
          [
            150,
            60
          ],
          [
            190,
            100
          ],
          [
            220,
            100
          ]
        ]
      ]
    },
    {
      "index": 4,
      "name": "04 Dark Red",
      "width_mm": 1.2,
      "centrelines": [
        [
          [
            70,
            120
          ],
          [
            160,
            120
          ],
          [
            200,
            150
          ]
        ]
      ]
    },
    {
      "index": 5,
      "name": "05 White",
      "width_mm": 0.9,
      "centrelines": [
        [
          [
            90,
            90
          ],
          [
            110,
            90
          ],
          [
            130,
            110
          ],
          [
            150,
            90
          ],
          [
            170,
            90
          ]
        ]
      ]
    },
    {
      "index": 6,
      "name": "06 Detail",
      "width_mm": 0.85,
      "centrelines": [
        [
          [
            50,
            140
          ],
          [
            50,
            160
          ]
        ],
        [
          [
            200,
            140
          ],
          [
            200,
            160
          ]
        ],
        [
          [
            50,
            150
          ],
          [
            200,
            150
          ]
        ]
      ]
    }
  ]
}
