{
  "project_id": "MASK-T08-002",
  "revision": 1,
  "target": {
    "object": "Angle probe",
    "part": "Flat",
    "part_code": "ANG",
    "dimensions_mm": [
      40.0,
      40.0
    ]
  },
  "_comment": "TEST A3. A traced figure whose top vertex measures 20.6°, below the 30° minimum. Expected: min_angle warning naming that vertex; --round-corners fills it. Sits between the control (A1, 43.6°) and the sharp case (A2, 18.9°).",
  "_expect": {
    "outcome": "verdict",
    "verdict": "PASS_WITH_WARNINGS",
    "warnings": [
      "min_angle"
    ]
  },
  "layers": [
    {
      "index": 1,
      "name": "Sharp Spike",
      "regions": [
        {
          "outer": [
            [
              14,
              6
            ],
            [
              22,
              6
            ],
            [
              22,
              14
            ],
            [
              18,
              36
            ],
            [
              14,
              14
            ]
          ],
          "holes": []
        }
      ]
    }
  ]
}
