{
  "project_id": "MASK-TRC-001",
  "revision": 1,
  "_comment": "TRACED from a 60x40 image at 120 mm wide, so 2 mm per pixel. Colour layers, no cut width: widths come from the profile. Validate before cutting.",
  "_expect": {
    "outcome": "verdict",
    "verdict": "FAIL",
    "errors": [
      "island_anchored"
    ]
  },
  "target": {
    "object": "Traced image",
    "part": "Traced",
    "part_code": "TRACE",
    "dimensions_mm": [
      120.0,
      80.0
    ]
  },
  "layers": [
    {
      "index": 1,
      "name": "colour f8f8f8",
      "regions": [
        {
          "outer": [
            [
              0.0,
              0.0
            ],
            [
              120.0,
              0.0
            ],
            [
              120.0,
              80.0
            ],
            [
              0.0,
              80.0
            ],
            [
              0.0,
              2.0
            ]
          ],
          "holes": [
            [
              [
                16.0,
                16.0
              ],
              [
                16.0,
                64.0
              ],
              [
                64.0,
                64.0
              ],
              [
                64.0,
                16.0
              ],
              [
                18.0,
                16.0
              ]
            ],
            [
              [
                80.0,
                36.0
              ],
              [
                80.0,
                44.0
              ],
              [
                112.0,
                44.0
              ],
              [
                112.0,
                36.0
              ],
              [
                82.0,
                36.0
              ]
            ]
          ]
        },
        {
          "outer": [
            [
              28.0,
              28.0
            ],
            [
              52.0,
              28.0
            ],
            [
              52.0,
              52.0
            ],
            [
              28.0,
              52.0
            ],
            [
              28.0,
              30.0
            ]
          ],
          "holes": []
        }
      ],
      "_area_mm2": 7616.0
    },
    {
      "index": 2,
      "name": "colour 000000",
      "regions": [
        {
          "outer": [
            [
              16.0,
              16.0
            ],
            [
              64.0,
              16.0
            ],
            [
              64.0,
              64.0
            ],
            [
              16.0,
              64.0
            ],
            [
              16.0,
              18.0
            ]
          ],
          "holes": [
            [
              [
                28.0,
                28.0
              ],
              [
                28.0,
                52.0
              ],
              [
                52.0,
                52.0
              ],
              [
                52.0,
                28.0
              ],
              [
                30.0,
                28.0
              ]
            ]
          ]
        },
        {
          "outer": [
            [
              80.0,
              36.0
            ],
            [
              112.0,
              36.0
            ],
            [
              112.0,
              44.0
            ],
            [
              80.0,
              44.0
            ],
            [
              80.0,
              38.0
            ]
          ],
          "holes": []
        }
      ],
      "_area_mm2": 1984.0
    }
  ]
}
