{
  "project_id": "MASK-GAP-001",
  "revision": 1,
  "target": {
    "object": "Gap probe",
    "part": "Flat",
    "part_code": "GAP",
    "dimensions_mm": [
      60.0,
      40.0
    ]
  },
  "_comment": "TEST G1. Two bars 0.40 mm apart, below the 0.90 mm minimum gap. Expected: FAIL on min_gap, and the report must name both elements.",
  "_expect": {
    "outcome": "verdict",
    "verdict": "FAIL",
    "errors": [
      "min_gap"
    ],
    "warnings": [
      "layer_density",
      "min_feature_length"
    ]
  },
  "layers": [
    {
      "index": 1,
      "name": "Too Close",
      "width_mm": 1.0,
      "centrelines": [
        [
          [
            2,
            10
          ],
          [
            12,
            10
          ]
        ],
        [
          [
            12.4,
            10
          ],
          [
            22,
            10
          ]
        ]
      ]
    }
  ]
}
