{
  "project_id": "MASK-FEA-001",
  "revision": 1,
  "target": {
    "object": "Feature probe",
    "part": "Flat",
    "part_code": "FEA",
    "dimensions_mm": [
      100.0,
      65.0
    ]
  },
  "_comment": "TEST F1. A 90x55 mm figure whose outline has one non-collinear 0.32 mm edge. Expected: min_feature_length warning — the knife rounds that edge off — and no error, because the figure is wide enough to cut.",
  "_expect": {
    "outcome": "verdict",
    "verdict": "PASS_WITH_WARNINGS",
    "warnings": [
      "min_feature_length"
    ]
  },
  "layers": [
    {
      "index": 1,
      "name": "Short Kink",
      "regions": [
        {
          "outer": [
            [
              5,
              5
            ],
            [
              95,
              5
            ],
            [
              95,
              60
            ],
            [
              40.3,
              59.9
            ],
            [
              40,
              60
            ],
            [
              5,
              60
            ]
          ],
          "holes": []
        }
      ]
    }
  ]
}
